№;Задача;Перечень мероприятий;Срок выполнения;Дата и время создания;Дата и время изменения
1;Подготовиться к контрольной;Повторить теорию, уяснить задачу, написать код.;до 25 апреля;24.04.2023 15:51;24.04.2023 15:51
2;Проверить сочинение;Прочитать, проверить по критериям ЕГЭ, обсудить с сыном.;24 апреля;24.04.2023 15:54;
3;Покормить кота;Утром насыпать сухой корм, вечером - желе.;ежедневно;24.04.2023 15:55;
4;Полить цветы ;Подготовить воду, добавить витамины.;24 апреля, вечер;24.04.2023 15:56;
5;Выполнить ДЗ по Linux;Доделать задание 3 и 4, оформить, отправить на проверку.;24 апреля до 18.00;24.04.2023 15:58;24.04.2023 15:58
